Symbol,Name,Last Sale,Net Change,% Change,Market Cap,Country,IPO Year,Volume,Sector,Industry
NTN,NTN Buzztime Inc. Common Stock,$3.1797,0.0797,2.571%,9423365.00,United States,,635654,Health Care,Major Pharmaceuticals
NXE,Nexgen Energy Ltd. Common Shares,$2.83,0.03,1.071%,1068919495.00,,,813201,Basic Industries,Precious Metals
OBLG,Oblong Inc. Common Stock,$4.999,0.279,5.911%,38735396.00,United States,,350526,Technology,Computer Software: Programming Data Processing
OCX,OncoCyte Corporation Common Stock,$5.8699,1.1099,23.317%,394754526.00,United States,2015,3937979,Health Care,Biotechnology: In Vitro & In Vivo Diagnostic Substances
OGEN,Oragenics Inc. Common Stock,$1.0499,-0.0401,-3.679%,96346098.00,United States,,15470804,Health Care,Major Pharmaceuticals
ORLA,Orla Mining Ltd. Common Shares,$4.3199,-0.2001,-4.427%,989110223.00,,2020,87671,Basic Industries,Precious Metals
PCG.PRA,Pacific Gas & Electric Co.,NA,,,,,,0,,
PCG.PRB,Pacific Gas & Electric Co.,NA,,,,,,0,,
PCG.PRC,Pacific Gas & Electric Co.,NA,,,,,,0,,
PCG.PRD,Pacific Gas & Electric Co.,NA,,,,,,0,,
PCG.PRE,Pacific Gas & Electric Co.,NA,,,,,,0,,
PCG.PRG,Pacific Gas & Electric Co.,NA,,,,,,0,,
PCG.PRH,Pacific Gas & Electric Co.,NA,,,,,,0,,
PCG.PRI,Pacific Gas & Electric Co.,NA,,,,,,0,,
PED,Pedevco Corp. Common Stock,$1.6176,0.0776,5.039%,117216699.00,United States,,1011122,Energy,Oil & Gas Production
PHGE,BiomX Inc. COmmon Stock,$6.58,0.07,1.075%,152965602.00,,2019,21377,Health Care,Biotechnology: Biological Products (No Diagnostic Substances)
PHGE.U,BiomX Inc. Units,NA,,,,,2018,0,,
PHGE.WS,BiomX Inc. Warrants,NA,,,,,,0,,
PLAG,Planet Green Holdings Corp. Common Stock,$2.62,-0.0273,-1.031%,34656744.00,China,,44730,Consumer Non-Durables,Packaged Foods
PLG,Platinum Group Metals Ltd. Ordinary Shares (Canada),$4.081,-0.109,-2.601%,294688096.00,Canada,,1824355,Basic Industries,Precious Metals
PLM,Polymet Mining Corporation Ordinary Shares (Canada),$3.91,-0.06,-1.511%,393735890.00,Canada,,978603,Basic Industries,Precious Metals
PLX,Protalix BioTherapeutics Inc. (DE) Common Stock,$4.51,-0.07,-1.528%,150348558.00,Israel,,179171,Health Care,Biotechnology: Biological Products (No Diagnostic Substances)
PLYM.PRA,Plymouth Industrial REIT Inc.,NA,,,,,,0,,
PRK,Park National Corporation Common Stock,$111.99,-1.73,-1.521%,1827027818.00,United States,,22785,Finance,Major Banks
PTK,PTK Acquisition Corp. Common Stock,$10.55,0.155,1.491%,151656250.00,United States,2020,128548,Finance,Business Services
PTK.U,PTK Acquisition Corp. Units,NA,,,,United States,2020,0,,
PTK.WS,PTK Acquisition Corp. Warrants each whole warrant exercisable for one half (1/2) of a share of Common Stock at an exercise price of $11.50,NA,,,,United States,,0,,
PTN,Palatin Technologies Inc. Common Stock,$1.055,-0.015,-1.402%,242545879.00,United States,,7477881,Health Care,Major Pharmaceuticals
PW,Power REIT (MD) Common Stock,$32.74,1.16,3.673%,62734391.00,United States,,44881,Consumer Services,Real Estate Investment Trusts
PW.PRA,Power REIT,NA,,,,,,0,,
PZG,Paramount Gold Nevada Corp. Common Stock,$1.11,-0.03,-2.632%,38059335.00,United States,2015,183787,Basic Industries,Precious Metals
RCG,RENN Fund Inc Common Stock,$2.0645,-0.0229,-1.097%,12287813.00,United States,,21840,,
REI,Ring Energy Inc. Common Stock,$1.06,0.02,1.923%,86568716.00,United States,,3600385,Energy,Oil & Gas Production
RHE,Regional Health Properties Inc. Common Stock,$3.8846,0.2946,8.206%,6558056.00,,2017,334042,Consumer Services,Real Estate
RHE.PRA,Regional Health Properties Inc.,NA,,,,,,0,,
RLGT,Radiant Logistics Inc. Common Stock,$6.33,-0.13,-2.012%,314474824.00,United States,,167229,Transportation,Oil Refining/Marketing
RMED,Ra Medical Systems Inc. Common Stock,$7.6564,-0.0536,-0.695%,22351191.00,,2018,284843,Health Care,Medical/Dental Instruments
RVP,Retractable Technologies Inc. Common Stock,$13.45,0.67,5.243%,454833324.00,United States,,1789710,Health Care,Medical/Dental Instruments
SACC,Sachem Capital Corp. 6.875% Notes due 2024,$24.93,-0.01,-0.04%,0.00,United States,2019,4244,Consumer Services,Real Estate Investment Trusts
SACH,Sachem Capital Corp. Common Shares,$4.2778,0.0778,1.852%,94645474.00,United States,2017,209632,Consumer Services,Real Estate Investment Trusts
SCCB,Sachem Capital Corp. 7.125% Notes due 2024,$25.50,0.23,0.91%,0.00,United States,2019,1920,Consumer Services,Real Estate Investment Trusts
SCCC,Sachem Capital Corp. 7.75% Notes due 2025,$25.2985,0.1885,0.751%,0.00,United States,2020,32629,Consumer Services,Real Estate Investment Trusts
SDPI,Superior Drilling Products Inc. Common Stock,$0.97,0.01,1.042%,24848961.00,,2014,3039825,Energy,Metal Fabrications
SEB,Seaboard Corporation Common Stock,$3150.005,26.005,0.832%,3656459654.00,United States,1996,889,Consumer Services,Farming/Seeds/Milling
SENS,Senseonics Holdings Inc. Common Stock,$2.8491,0.5391,23.338%,699928741.00,United States,,91966210,Capital Goods,Industrial Machinery/Components
SIF,SIFCO Industries Inc. Common Stock,$9.915,-0.195,-1.929%,58658360.00,United States,,30284,Capital Goods,Aerospace
SILV,SilverCrest Metals Inc. Common Shares,$9.08,-0.17,-1.838%,1173450449.00,,2018,840472,Basic Industries,Precious Metals
SIM,Grupo Simec S.A.B. de C.V. American Depositary Shares,$13.5016,-0.9884,-6.821%,2085207856.00,Mexico,1993,3413,Basic Industries,Steel/Iron Ore
SMTS,Sierra Metals Inc. Common Stock,$3.37,-0.03,-0.882%,548636000.00,,,727500,Basic Industries,Precious Metals
SNMP,Sanchez Midstream Partners LP Common Stock,$1.23,0.3514,39.995%,24543272.00,United States,,11998419,Energy,Oil & Gas Production
SSY,SunLink Health Systems Inc. Common Stock,$1.6301,0.0901,5.851%,11246583.00,United States,,714125,Health Care,Hospital/Nursing Management
STXS,Stereotaxis Inc. Common Stock,$4.79,-0.20,-4.008%,352954163.00,United States,,88633,Health Care,Biotechnology: Electromedical & Electrotherapeutic Apparatus
SVM,Silvercorp Metals Inc. Common Shares,$5.86,-0.13,-2.17%,1026680579.00,,,955463,Basic Industries,Precious Metals
SVT,Servotronics Inc. Common Stock,$8.795,0.195,2.267%,21885715.00,United States,,1013,Capital Goods,Industrial Machinery/Components
SYN,Synthetic Biologics Inc. Common Stock,$0.9296,0.018,1.975%,49891384.00,United States,,22509581,Health Care,Major Pharmaceuticals
TALO.WS,Talos Energy Inc. Warrants,NA,,,,United States,,0,,
TDW.WS,Tidewater Inc. Warrant,NA,,,,United States,,0,,
TGB,Taseko Mines Ltd. Common Stock,$1.245,-0.045,-3.488%,347609461.00,Canada,,2490225,Basic Industries,Precious Metals
TGC,Tengasco Inc. Common Stock,$1.6399,0.2199,15.486%,17521375.00,United States,,2300547,Energy,Oil & Gas Production
THM,International Tower Hill Mines Ltd. Ordinary Shares (Canada),$1.315,-0.005,-0.379%,256304262.00,Canada,,182221,Basic Industries,Precious Metals
TKAT,Takung Art Co. Ltd. Common Stock,$1.91,-0.05,-2.551%,21528334.00,,,87166,Consumer Services,Other Specialty Stores
TMBR,Timber Pharmaceuticals Inc. Common Stock,$1.2289,0.0889,7.798%,14561274.00,United States,2015,12422398,Health Care,Major Pharmaceuticals
TMP,Tompkins Financial Corporation Common Stock,$75.375,-1.495,-1.945%,1125434150.00,United States,,32517,Finance,Major Banks
TMQ,Trilogy Metals Inc. Common Stock,$2.12,-0.02,-0.935%,303168857.00,Canada,,512797,Basic Industries,Precious Metals
TPHS,Trinity Place Holdings Inc. Common Stock,$2.05,-0.10,-4.651%,65952819.00,,,64074,Consumer Services,Building operators
TRT,Trio-Tech International Common Stock,$4.5971,-0.3229,-6.563%,17057792.00,United States,,39868,Technology,Industrial Machinery/Components
TRX,Tanzanian Gold Corporation Common Stock,$0.7153,0.0443,6.602%,149243067.00,Canada,,2048601,Basic Industries,Precious Metals
TRXC,TransEnterix Inc. Common Stock,$3.7303,0.0203,0.547%,656520251.00,United States,,44652244,Health Care,Medical/Dental Instruments
UAMY,United States Antimony Corporation Common Stock,$0.9509,0.1109,13.202%,72074240.00,United States,,14032182,Capital Goods,Metal Fabrications
UAVS,AgEagle Aerial Systems Inc. Common Stock,$11.86,-2.03,-14.615%,695427289.00,United States,,9149595,Capital Goods,Aerospace
UEC,Uranium Energy Corp. Common Stock,$1.67,-0.03,-1.765%,332428375.00,Canada,,3490405,Basic Industries,Precious Metals
UFAB,Unique Fabricating Inc. Common Stock,$7.46,0.205,2.826%,72952437.00,United States,2015,24887,Capital Goods,Auto Parts:O.E.M.
URG,Ur Energy Inc Common Shares (Canada),$0.9262,-0.0041,-0.441%,157146198.00,Canada,,3953292,Basic Industries,Precious Metals
USAS,Americas Gold and Silver Corporation Common Shares no par value,$2.5099,-0.1001,-3.835%,296106906.00,,2017,1287625,Basic Industries,Precious Metals
UTG,Reaves Utility Income Fund Common Shares of Beneficial Interest,$32.9388,0.0388,0.118%,1776598843.00,United States,2004,248951,,
UUU,Universal Security Instruments Inc. Common Stock,$5.84,0.11,1.92%,13507260.00,United States,,469375,Technology,Electronic Components
UUUU,Energy Fuels Inc Ordinary Shares (Canada),$3.885,-0.055,-1.396%,521718523.00,,,2536118,Basic Industries,Mining & Quarrying of Nonmetallic Minerals (No Fuels)
UUUU.WS,Energy Fuels Inc Warrants exercisable for one common share until September 20 2021 at an exercise price of $2.45,NA,,,,,,0,,
VCF,Delaware Investments Colorado Municipal Income Fund Inc  Common Stock,$14.16,-0.1299,-0.909%,68493336.00,United States,1993,2769,,
VFL,Delaware Investments National Municipal Income Fund Common Stock,$13.30,-0.12,-0.894%,60228292.00,United States,1993,15036,,
VGZ,Vista Gold Corp Common Stock,$0.9339,0.0039,0.419%,95897245.00,United States,,765381,Basic Industries,Precious Metals
VHAQ.U,Viveon Health Acquisition Corp. Units each consisting of one share of common stock one Warrant entitling the holder to purchase one-half of a share of common stock and one right to receive one-twentieth of a share of common stock,NA,,,,,2020,0,,
VKI,Invesco Advantage Municipal Income Trust II Common Shares of Beneficial Interest (DE),$11.485,0.025,0.218%,509836963.00,United States,,84720,,
VMM,Delaware Investments Minnesota Municipal Income Fund II Inc. Common Stock,$13.28,-0.01,-0.075%,152786068.00,United States,1993,14728,,
VNRX,VolitionRX Limited Common Stock,$4.94,0.48,10.762%,238096574.00,Singapore,2015,1569177,Health Care,Biotechnology: In Vitro & In Vivo Diagnostic Substances
VOLT,Volt Information Sciences Inc. Common Stock,$2.83,-0.11,-3.741%,61514507.00,United States,,145426,Technology,Professional Services
WRN,Western Copper and Gold Corporation Common Stock,$1.2127,-0.0273,-2.202%,164439252.00,Canada,2011,384208,Basic Industries,Precious Metals
WTT,Wireless Telecom Group  Inc. Common Stock,$2.06,0.02,0.98%,44691721.00,United States,,110800,Capital Goods,Telecommunications Equipment
WYY,WidePoint Corporation Common Stock,$14.07,-0.42,-2.899%,119014387.00,United States,,474813,Technology,EDP Services
XPL,Solitario Zinc Corp. Common Stock,$0.8264,0.0301,3.78%,48020754.00,United States,,10615837,Basic Industries,Precious Metals
XTNT,Xtant Medical Holdings Inc. Common Stock,$1.5796,0.0996,6.73%,121409689.00,United States,,206198,Health Care,Biotechnology: Biological Products (No Diagnostic Substances)
XXII,22nd Century Group Inc. Common Stock,$2.78,-0.01,-0.358%,386028557.00,United States,,2513622,Consumer Non-Durables,Farming/Seeds/Milling
YCBD,cbdMD Inc. Common Stock,$3.48,-0.25,-6.702%,181415428.00,United States,2017,729447,Consumer Non-Durables,Package Goods/Cosmetics
YCBD.PRA,cbdMD Inc.,NA,,,,,,0,,
ZDGE,Zedge Inc. Class B Common Stock ,$9.44,1.49,18.742%,118224549.00,,2016,451533,Technology,Computer Software: Prepackaged Software
ZOM,Zomedica Corp. Common Shares,$1.0189,0.0627,6.557%,845218356.00,United States,2017,129068908,Health Care,Major Pharmaceuticals
